"user_statuses_count","user_followers_count","full_text","user_url","user_location","user_description","user_profile_image_url_https","is_quote_status","quote_count","user_friends_count","full_text_norm","entities_user_mentions","entities_urls","in_reply_to_user_id_str","favorite_count","lang","user_created_at","user_listed_count","created_at","user_id_str","user_favourites_count","user_verified","source","in_reply_to_status_id_str","reply_count","in_reply_to_screen_name","id_str","entities_hashtags","text_sentiment","retweet_count","user_name","user_screen_name"
"None","None","Jajan cilok buatan Ibu Nurhayati, pengusaha super mikro binaan Program Mekaar di Ciracas, Jakarta Timur, kemarin. Sejak dimulai 2015, PNM Mekaar telah melayani 4.057.000 usaha seperti Ibu Nurhayati di seluruh Indonesia. Saya berharap, dari Mekaar mereka naik tingkat jadi UKM.","None","None","None","None","None","None","None","Jajan cilok buatan Ibu Nurhayati, pengusaha super mikro binaan Program Mekaar di Ciracas, Jakarta Timur, kemarin. Sejak dimulai 2015, PNM Mekaar telah melayani 4.057.000 usaha seperti Ibu Nurhayati di seluruh Indonesia. Saya berharap, dari Mekaar mereka naik tingkat jadi UKM.","","None","",13505,"None","None","None","2019-01-11 03:09","None","None","None","None","None",1396,"","1083561385542348800","","positive",3032,"Joko Widodo","jokowi"
"None","None","Beras di gudang Bulog di Jakarta. Persediaan beras kita di akhir Desember biasanya 700-800 ribu ton, sekarang 2,1 juta ton. Stok beras ini untuk menjaga stabilitas harga di pasaran. Operasi pasar Bulog mulai 3 Januari lalu efektif menjaga harga beras di tingkat masyarakat.","None","None","None","None","None","None","None","Beras di gudang Bulog di Jakarta. Persediaan beras kita di akhir Desember biasanya 700-800 ribu ton, sekarang 2,1 juta ton. Stok beras ini untuk menjaga stabilitas harga di pasaran. Operasi pasar Bulog mulai 3 Januari lalu efektif menjaga harga beras di tingkat masyarakat.","","None","",10312,"None","None","None","2019-01-10 11:54","None","None","None","None","None",902,"","1083331139324981250","","neutral",2381,"Joko Widodo","jokowi"
"None","None","Saya menyerahkan 3.023 lembar sertifikat untuk warga 8 kecamatan di Jakarta Barat, kemarin. Belum semua tanah di ibu kota ini bersertifikat. Sampai akhir tahun 2018, baru 92 %. Jika lancar, pendaftaran seluruh bidang tanah di Jakarta akan selesai akhir 2019.","None","None","None","None","None","None","None","Saya menyerahkan 3.023 lembar sertifikat untuk warga 8 kecamatan di Jakarta Barat, kemarin. Belum semua tanah di ibu kota ini bersertifikat. Sampai akhir tahun 2018, baru 92 %. Jika lancar, pendaftaran seluruh bidang tanah di Jakarta akan selesai akhir 2019.","","None","",7076,"None","None","None","2019-01-10 06:11","None","None","None","None","None",579,"","1083244916505899009","","neutral",1436,"Joko Widodo","jokowi"
"None","None","Dengan MEKAAR, usaha keluarga jadi mekar. Sejak dimulai tahun 2015, Program Mekaar dari PNM telah melayani 4.057.000 penerima program di seluruh Indonesia. Salah satunya, warga Kelurahan Kali Anyar di Jakarta Barat yang saya kunjungi, Rabu kemarin.","None","None","None","None","None","None","None","Dengan MEKAAR, usaha keluarga jadi mekar. Sejak dimulai tahun 2015, Program Mekaar dari PNM telah melayani 4.057.000 penerima program di seluruh Indonesia. Salah satunya, warga Kelurahan Kali Anyar di Jakarta Barat yang saya kunjungi, Rabu kemarin.","","None","",9861,"None","None","None","2019-01-10 01:47","None","None","None","None","None",434,"","1083178375433187329","","neutral",2147,"Joko Widodo","jokowi"
"None","None","Negara kita ini berada di ring of fire yang rawan bencana. Kita perlu manajemen dan kepemimpinan kuat merespons bencana. Syarat itu ada dalam sosok Letjen Doni Monardo yang saya lantik jadi Kepala Badan Nasional Penanggulangan Bencana, pagi tadi. Selamat bekerja Pak Doni.","None","None","None","None","None","None","None","Negara kita ini berada di ring of fire yang rawan bencana. Kita perlu manajemen dan kepemimpinan kuat merespons bencana. Syarat itu ada dalam sosok Letjen Doni Monardo yang saya lantik jadi Kepala Badan Nasional Penanggulangan Bencana, pagi tadi. Selamat bekerja Pak Doni.","","None","",11685,"None","None","None","2019-01-09 12:45","None","None","None","None","None",483,"","1082981772042727429","","neutral",2482,"Joko Widodo","jokowi"
"None","None","Mari mendoakan kesembuhan Ustaz Arifin Ilham yang saat ini dirawat di Rumah Sakit Cipto Mangunkusumo, Jakarta. Semoga beliau cepat sembuh, penyakitnya diangkat oleh Allah SWT. Masyarakat menunggu Ustaz Arifin Ilham untuk berdakwah dan berkegiatan seperti sedia kala. Amin.","None","None","None","None","None","None","None","Mari mendoakan kesembuhan Ustaz Arifin Ilham yang saat ini dirawat di Rumah Sakit Cipto Mangunkusumo, Jakarta. Semoga beliau cepat sembuh, penyakitnya diangkat oleh Allah SWT. Masyarakat menunggu Ustaz Arifin Ilham untuk berdakwah dan berkegiatan seperti sedia kala. Amin.","","None","",27805,"None","None","None","2019-01-09 04:06","None","None","None","None","None",2372,"","1082851185147531267","","positive",7408,"Joko Widodo","jokowi"
"None","None","Hitungan Bappenas, macet di Jabodetabek merugikan sampai Rp65 triliun per tahun. Ini tidak boleh dibiarkan. Kalau MRT dan LRT sudah jadi, kereta bandara siap, dan TransJakarta ada, masyarakat didorong pindah dari kendaraan pribadi. Rp65 triliun jangan menguap jadi asap saja.","None","None","None","None","None","None","None","Hitungan Bappenas, macet di Jabodetabek merugikan sampai Rp65 triliun per tahun. Ini tidak boleh dibiarkan. Kalau MRT dan LRT sudah jadi, kereta bandara siap, dan TransJakarta ada, masyarakat didorong pindah dari kendaraan pribadi. Rp65 triliun jangan menguap jadi asap saja.","","None","",13517,"None","None","None","2019-01-09 02:23","None","None","None","None","None",948,"","1082825179124752384","","negative",3956,"Joko Widodo","jokowi"
"None","None","Pertumbuhan ekonomi nasional 2018 diperkirakan 5,15 %, inflasi di bawah 3,5 %, dan nilai tukar rupiah terjaga. Kinerja APBN 2018 sangat sehat dan kredibel, defisit hanya 1,76 % dari PDB, dan pendapatan sepanjang 2018 melampaui target APBN. Kita memasuki 2019 dengan rasa syukur.","None","None","None","None","None","None","None","Pertumbuhan ekonomi nasional 2018 diperkirakan 5,15 %, inflasi di bawah 3,5 %, dan nilai tukar rupiah terjaga. Kinerja APBN 2018 sangat sehat dan kredibel, defisit hanya 1,76 % dari PDB, dan pendapatan sepanjang 2018 melampaui target APBN. Kita memasuki 2019 dengan rasa syukur.","","None","",14309,"None","None","None","2019-01-07 12:15","None","None","None","None","None",1320,"","1082249398019534851","","positive",4090,"Joko Widodo","jokowi"
"None","None","Empat tahun berjalan, kita membangun fondasi yang kokoh, fokus pada percepatan pembangunan infrastruktur serta peningkatan produktivitas dan daya saing bangsa. Kini, masa depan Indonesia terletak pada kemampuan kita mempersiapkan manusia Indonesia yang maju dan unggul.","None","None","None","None","None","None","None","Empat tahun berjalan, kita membangun fondasi yang kokoh, fokus pada percepatan pembangunan infrastruktur serta peningkatan produktivitas dan daya saing bangsa. Kini, masa depan Indonesia terletak pada kemampuan kita mempersiapkan manusia Indonesia yang maju dan unggul.","","None","",17751,"None","None","None","2019-01-07 07:43","None","None","None","None","None",1601,"","1082180985381240832","","positive",5307,"Joko Widodo","jokowi"
"None","None","Tahun lalu, Pipiet Kamelia dan Hanifan Yudani Kusumah menyandingkan medali emas pencak silat Asian Games 2018 dari nomor tarung putri dan putra. Kemarin, mereka menyandingkan cincin emas di pelaminan. Selamat atas pernikahan Pipiet dan Hanifan. Semoga menjadi keluarga sakinah.","None","None","None","None","None","None","None","Tahun lalu, Pipiet Kamelia dan Hanifan Yudani Kusumah menyandingkan medali emas pencak silat Asian Games 2018 dari nomor tarung putri dan putra. Kemarin, mereka menyandingkan cincin emas di pelaminan. Selamat atas pernikahan Pipiet dan Hanifan. Semoga menjadi keluarga sakinah.","","None","",16839,"None","None","None","2019-01-06 01:12","None","None","None","None","None",586,"","1081720216936079360","","positive",3103,"Joko Widodo","jokowi"
"None","None","Kopi empat ribu perak, es cappuccino lima ribu perak, hanya ada di Angkringanku, kafe Mas Aji dari Tulungagung. Slurrrrp!","None","None","None","None","None","None","None","Kopi empat ribu perak, es cappuccino lima ribu perak, hanya ada di Angkringanku, kafe Mas Aji dari Tulungagung. Slurrrrp!","","None","",16076,"None","None","None","2019-01-05 07:39","None","None","None","None","None",1121,"","1081455021114310656","","positive",3437,"Joko Widodo","jokowi"
"None","None","Jawa Timur adalah salah satu lumbung padi terbesar Indonesia. Maka kita bangun Waduk Bendo, Waduk Tukul, Waduk Tugu, Waduk Bagong, Waduk Semantok, dan Waduk Gongseng. Ini Waduk Bendo di Ponorogo yang akan selesai akhir 2019, bisa menampung 43 juta m3 air, untuk 7.700 ha sawah.","None","None","None","None","None","None","None","Jawa Timur adalah salah satu lumbung padi terbesar Indonesia. Maka kita bangun Waduk Bendo, Waduk Tukul, Waduk Tugu, Waduk Bagong, Waduk Semantok, dan Waduk Gongseng. Ini Waduk Bendo di Ponorogo yang akan selesai akhir 2019, bisa menampung 43 juta m3 air, untuk 7.700 ha sawah.","","None","",13761,"None","None","None","2019-01-05 03:41","None","None","None","None","None",1057,"","1081395130924298241","","neutral",3426,"Joko Widodo","jokowi"
"None","None","Wajah-wajah ceria mahasiswa STKIP PGRI Tulungagung, Jawa Timur. Rumah susun untuk mereka sudah jadi dan saya resmikan. Belajar yang baik, demi masa depan kalian, demi masa Indonesia yang maju.","None","None","None","None","None","None","None","Wajah-wajah ceria mahasiswa STKIP PGRI Tulungagung, Jawa Timur. Rumah susun untuk mereka sudah jadi dan saya resmikan. Belajar yang baik, demi masa depan kalian, demi masa Indonesia yang maju.","","None","",14216,"None","None","None","2019-01-04 13:39","None","None","None","None","None",745,"","1081183338126237698","","positive",2843,"Joko Widodo","jokowi"
"None","None","Salah satu kamar Rusun Mahasiswa STKIP PGRI Tulungagung, satu dari tiga rusun di Jawa Timur yang saya resmikan hari ini. Perabotnya lengkap sampai meja belajar. Kualitasnya bagus. Tahun 2018, pemerintah membangun 275 tower rusun. Tahun ini, kita akan bangun 300 tower lagi.","None","None","None","None","None","None","None","Salah satu kamar Rusun Mahasiswa STKIP PGRI Tulungagung, satu dari tiga rusun di Jawa Timur yang saya resmikan hari ini. Perabotnya lengkap sampai meja belajar. Kualitasnya bagus. Tahun 2018, pemerintah membangun 275 tower rusun. Tahun ini, kita akan bangun 300 tower lagi.","","None","",10319,"None","None","None","2019-01-04 11:01","None","None","None","None","None",575,"","1081143497153961984","","positive",2405,"Joko Widodo","jokowi"
"None","None","Lebih dari sembilan juta lembar sertifikat tanah terbit sepanjang tahun 2018 kemarin. Ini jauh di atas target yang saya patok. Alhamdulillah. Sertifikat hak atas tanah memberikan kepastian hukum kepada masyarakat, mengurangi bahkan menghilangkan sengketa tanah sama sekali.","None","None","None","None","None","None","None","Lebih dari sembilan juta lembar sertifikat tanah terbit sepanjang tahun 2018 kemarin. Ini jauh di atas target yang saya patok. Alhamdulillah. Sertifikat hak atas tanah memberikan kepastian hukum kepada masyarakat, mengurangi bahkan menghilangkan sengketa tanah sama sekali.","","None","",8670,"None","None","None","2019-01-04 06:33","None","None","None","None","None",717,"","1081076055299878912","","negative",1800,"Joko Widodo","jokowi"
"None","None","Di teras makam Bung Karno bersama Pak Pramono Anung dan Pakde Sukarwo. Saya berziarah ke makam Sang Proklamator kemarin, di sela kunjungan kerja di Blitar. Semoga almarhum yang telah berjuang mendirikan bangsa ini mendapat tempat yang lapang di sisiNya. Amin. Selamat pagi.","None","None","None","None","None","None","None","Di teras makam Bung Karno bersama Pak Pramono Anung dan Pakde Sukarwo. Saya berziarah ke makam Sang Proklamator kemarin, di sela kunjungan kerja di Blitar. Semoga almarhum yang telah berjuang mendirikan bangsa ini mendapat tempat yang lapang di sisiNya. Amin. Selamat pagi.","","None","",19148,"None","None","None","2019-01-04 01:46","None","None","None","None","None",1213,"","1081003848129380352","","positive",4215,"Joko Widodo","jokowi"
"None","None","Pulau Sebesi di Selat Sunda adalah daratan terdekat Gunung Anak Krakatau. Saat tsunami lalu, warga pulau ini lari ke ketinggian. Esoknya, mereka dievakuasi dan sampai kini berada di lokasi pengungsian di Lampung Selatan. Mereka meminta direlokasi ke daerah yang lebih tinggi.","None","None","None","None","None","None","None","Pulau Sebesi di Selat Sunda adalah daratan terdekat Gunung Anak Krakatau. Saat tsunami lalu, warga pulau ini lari ke ketinggian. Esoknya, mereka dievakuasi dan sampai kini berada di lokasi pengungsian di Lampung Selatan. Mereka meminta direlokasi ke daerah yang lebih tinggi.","","None","",8216,"None","None","None","2019-01-03 05:02","None","None","None","None","None",381,"","1080690850575699968","","positive",1691,"Joko Widodo","jokowi"
"None","None","Sampai siang tadi, Ibu Sarnama masih dirawat bersama putranya Yudi, 6 tahun, di RSUD dr. H. Bob Bazar, Lampung Selatan. Saat tsunami, 22 Desember lalu, keduanya selamat, tapi kakak dan adik Yuda meninggal. Semoga mereka segera pulih dan kembali berkegiatan seperti sedia kala.","None","None","None","None","None","None","None","Sampai siang tadi, Ibu Sarnama masih dirawat bersama putranya Yudi, 6 tahun, di RSUD dr. H. Bob Bazar, Lampung Selatan. Saat tsunami, 22 Desember lalu, keduanya selamat, tapi kakak dan adik Yuda meninggal. Semoga mereka segera pulih dan kembali berkegiatan seperti sedia kala.","","None","",7090,"None","None","None","2019-01-02 12:48","None","None","None","None","None",268,"","1080445666508210176","","neutral",1257,"Joko Widodo","jokowi"
"None","None","Jejak tsunami masih terlihat jelas di Desa Kunjir dan Desa Way Muli, dua desa di Lampung Selatan yang saya kunjungi hari ini. Selekas mungkin, kita akan masuk ke tahap rekonstruksi dan pembangunan rumah-rumah di kawasan relokasi, 400 m dari lokasi rawan tsunami.","None","None","None","None","None","None","None","Jejak tsunami masih terlihat jelas di Desa Kunjir dan Desa Way Muli, dua desa di Lampung Selatan yang saya kunjungi hari ini. Selekas mungkin, kita akan masuk ke tahap rekonstruksi dan pembangunan rumah-rumah di kawasan relokasi, 400 m dari lokasi rawan tsunami.","","None","",9252,"None","None","None","2019-01-02 08:06","None","None","None","None","None",716,"","1080374717171658752","","positive",1868,"Joko Widodo","jokowi"
"None","None","Selamat pagi. Kegiatan pertama saya 2019 adalah jogging pada 1 Januari di Kebun Raya Bogor yang ramai oleh masyarakat yang berolahraga dan berlibur. Hari Rabu ini saya ke Lampung meninjau korban bencana. Mari memasuki tahun yang baru ini dengan semangat dan optimisme!","None","None","None","None","None","None","None","Selamat pagi. Kegiatan pertama saya 2019 adalah jogging pada 1 Januari di Kebun Raya Bogor yang ramai oleh masyarakat yang berolahraga dan berlibur. Hari Rabu ini saya ke Lampung meninjau korban bencana. Mari memasuki tahun yang baru ini dengan semangat dan optimisme!","","None","",13583,"None","None","None","2019-01-02 03:04","None","None","None","None","None",818,"","1080298869978673152","","negative",2421,"Joko Widodo","jokowi"
"None","None","Pergantian tahun semalam, saya bersama para petugas dan pegawai istana menikmati sate, bakmi, dan wedang ronde di halaman Wisma Bayurini di Bogor. Tak ada yang istimewa kecuali satu hal: kita memasuki tahun 2019 ini dengan penuh optimisme.","None","None","None","None","None","None","None","Pergantian tahun semalam, saya bersama para petugas dan pegawai istana menikmati sate, bakmi, dan wedang ronde di halaman Wisma Bayurini di Bogor. Tak ada yang istimewa kecuali satu hal: kita memasuki tahun 2019 ini dengan penuh optimisme.","","None","",21967,"None","None","None","2019-01-01 05:26","None","None","None","None","None",1503,"","1079972041246162944","","positive",6115,"Joko Widodo","jokowi"
"None","None","Bersama terbenamnya matahari 2018 dan terbitnya fajar 2019, kita mengayunkan langkah sebagai bangsa yang besar dengan meninggalkan segenap pesimisme menuju optimisme, menanggalkan sifat individualisme ke arah kolaborasi, melepas sifat amarah menjadi manusia yang penyabar.","None","None","None","None","None","None","None","Bersama terbenamnya matahari 2018 dan terbitnya fajar 2019, kita mengayunkan langkah sebagai bangsa yang besar dengan meninggalkan segenap pesimisme menuju optimisme, menanggalkan sifat individualisme ke arah kolaborasi, melepas sifat amarah menjadi manusia yang penyabar.","","None","",17759,"None","None","None","2019-01-01 01:05","None","None","None","None","None",1151,"","1079906467082203136","","positive",5833,"Joko Widodo","jokowi"
"None","None","Akhir tahun ini kalian di mana? Apa yang baru? Adakah yang seru? Saya ingin mendengar dan membaca pengalaman berlibur bersama keluarga dan teman-teman, renungan akhir tahun, juga resolusi tahun baru dari kalian.","None","None","None","None","None","None","None","Akhir tahun ini kalian di mana? Apa yang baru? Adakah yang seru? Saya ingin mendengar dan membaca pengalaman berlibur bersama keluarga dan teman-teman, renungan akhir tahun, juga resolusi tahun baru dari kalian.","","None","",16230,"None","None","None","2018-12-31 05:58","None","None","None","None","None",2654,"","1079617859720892416","","neutral",4033,"Joko Widodo","jokowi"
"None","None","Blok Mahakam di Kalimantan, Blok Rokan di Riau, dan delapan blok migas lain yang puluhan tahun dikelola perusahaan asing, kembali ke Pertamina. Freeport tahun ini juga kita miliki 51 %. Kita menutup tahun 2018 sebagai bangsa yang semakin berdaulat atas kekayaan alam sendiri.","None","None","None","None","None","None","None","Blok Mahakam di Kalimantan, Blok Rokan di Riau, dan delapan blok migas lain yang puluhan tahun dikelola perusahaan asing, kembali ke Pertamina. Freeport tahun ini juga kita miliki 51 %. Kita menutup tahun 2018 sebagai bangsa yang semakin berdaulat atas kekayaan alam sendiri.","","None","",18596,"None","None","None","2018-12-31 01:29","None","None","None","None","None",1497,"","1079550022306263040","","positive",6879,"Joko Widodo","jokowi"
"None","None","Transaksi perdagangan saham 2018 di Bursa Efek Indonesia saya tutup Jumat lalu dengan angka IHSG 6.194, terbaik di Asia Tenggara, dan kinerja bursa terbaik kedua di Asia Pasifik. Laju inflasi pun terkendal. Ini membuat kita optimistis akan masa depan perekonomian Indonesia.","None","None","None","None","None","None","None","Transaksi perdagangan saham 2018 di Bursa Efek Indonesia saya tutup Jumat lalu dengan angka IHSG 6.194, terbaik di Asia Tenggara, dan kinerja bursa terbaik kedua di Asia Pasifik. Laju inflasi pun terkendal. Ini membuat kita optimistis akan masa depan perekonomian Indonesia.","","None","",13161,"None","None","None","2018-12-30 07:00","None","None","None","None","None",767,"","1079271098653409280","","neutral",3968,"Joko Widodo","jokowi"
"None","None","Ikut berbahagia menghadiri Perayaan Natal Nasional 2018 bersama masyarakat di Deli Serdang, Sumut, kemarin. Di mana ada si Rungguk, di situ ada si Tata. Di mana pun kita duduk, di situ selalu ada Tuhan Yang Maha Esa. Kiranya damai, sejahtera, selalu hadir di negara kita.","None","None","None","None","None","None","None","Ikut berbahagia menghadiri Perayaan Natal Nasional 2018 bersama masyarakat di Deli Serdang, Sumut, kemarin. Di mana ada si Rungguk, di situ ada si Tata. Di mana pun kita duduk, di situ selalu ada Tuhan Yang Maha Esa. Kiranya damai, sejahtera, selalu hadir di negara kita.","","None","",9976,"None","None","None","2018-12-30 04:24","None","None","None","None","None",523,"","1079231614939365377","","negative",2359,"Joko Widodo","jokowi"
"None","None","Bersilaturahmi dengan Syekh Haji Hasyim Al-Syarwani Tuan Guru Babussalam di kediamam Tuan Guru di Langkat, Sumatra Utara, siang ini.","None","None","None","None","None","None","None","Bersilaturahmi dengan Syekh Haji Hasyim Al-Syarwani Tuan Guru Babussalam di kediamam Tuan Guru di Langkat, Sumatra Utara, siang ini.","","None","",8879,"None","None","None","2018-12-29 09:20","None","None","None","None","None",378,"","1078943762020130817","","neutral",1708,"Joko Widodo","jokowi"
"None","None","Dari Jakarta, Semarang, sampai Surabaya, ada pilihan rute liburan. Selain jalan biasa, ada Jalan Tol Trans Jawa yang sambung menyambung 760 km. Jalannya mulus, pemandangannya indah: gunung, sawah, desa-desa, simpang susun, jembatan, kuliner lokal di rest area. Selamat berlibur.","None","None","None","None","None","None","None","Dari Jakarta, Semarang, sampai Surabaya, ada pilihan rute liburan. Selain jalan biasa, ada Jalan Tol Trans Jawa yang sambung menyambung 760 km. Jalannya mulus, pemandangannya indah: gunung, sawah, desa-desa, simpang susun, jembatan, kuliner lokal di rest area. Selamat berlibur.","","None","",24771,"None","None","None","2018-12-29 01:47","None","None","None","None","None",2102,"","1078829933529423872","","neutral",10557,"Joko Widodo","jokowi"
"None","None","Jakarta sampai Surabaya telah tersambung dengan jalan tol Trans Jawa. Rakyat senang, para pekerja yang membangun infrastruktur besar ini juga ikut bergembira. Lihatlah wajah para petugas lapangan pembangunan konstruksi Jembatan Kali Kuto ini ...","None","None","None","None","None","None","None","Jakarta sampai Surabaya telah tersambung dengan jalan tol Trans Jawa. Rakyat senang, para pekerja yang membangun infrastruktur besar ini juga ikut bergembira. Lihatlah wajah para petugas lapangan pembangunan konstruksi Jembatan Kali Kuto ini ...","","None","",25220,"None","None","None","2018-12-28 03:03","None","None","None","None","None",2532,"","1078486567008628736","","positive",10161,"Joko Widodo","jokowi"
"None","None","Seusai pengukuhan Kwartir Nasional Gerakan Pramuka masa bakti 2018-2023 di Jakarta, pagi ini. Janji mereka dalam Tri Satya di antaranya, menolong sesama hidup dan ikut serta membangun masyarakat. Selamat bekerja, mengantarkan kaum muda Indonesia ke masa depan yang lebih baik.","None","None","None","None","None","None","None","Seusai pengukuhan Kwartir Nasional Gerakan Pramuka masa bakti 2018-2023 di Jakarta, pagi ini. Janji mereka dalam Tri Satya di antaranya, menolong sesama hidup dan ikut serta membangun masyarakat. Selamat bekerja, mengantarkan kaum muda Indonesia ke masa depan yang lebih baik.","","None","",9981,"None","None","None","2018-12-27 11:20","None","None","None","None","None",388,"","1078249142596513792","","positive",1993,"Joko Widodo","jokowi"
"None","None","Bersama pekerja-pekerja Bendungan Sukamahi dan Bendungan Ciawi, dua bendungan di Jawa Barat, untuk pengendalian banjir Jakarta.","None","None","None","None","None","None","None","Bersama pekerja-pekerja Bendungan Sukamahi dan Bendungan Ciawi, dua bendungan di Jawa Barat, untuk pengendalian banjir Jakarta.","","None","",11753,"None","None","None","2018-12-26 13:32","None","None","None","None","None",714,"","1077920043592118273","","negative",2586,"Joko Widodo","jokowi"
"None","None","Bendungan Sukamahi dan Bendungan Ciawi di Bogor, Jawa Barat, dibangun khusus untuk mengendalikan banjir di Jakarta. Bila rampung tahun depan, dua bendungan ini menampung air sebelum dialirkan ke Bendung Katulampa, lalu dialirkan bertahap ke Jakarta.","None","None","None","None","None","None","None","Bendungan Sukamahi dan Bendungan Ciawi di Bogor, Jawa Barat, dibangun khusus untuk mengendalikan banjir di Jakarta. Bila rampung tahun depan, dua bendungan ini menampung air sebelum dialirkan ke Bendung Katulampa, lalu dialirkan bertahap ke Jakarta.","","None","",8805,"None","None","None","2018-12-26 08:59","None","None","None","None","None",552,"","1077851460774195200","","negative",1979,"Joko Widodo","jokowi"
"None","None","Dulu, warga Morowali di Sulteng jika ke Palu, menempuh 12 jam perjalanan darat 520 km. Ke Makassar yang lebih jauh, bisa naik kapal laut. Sekarang, mereka punya pilihan setelah Bandara Morowali beroperasi. Dari Morowali, naik pesawat ke Kendari tak sampai satu jam.","None","None","None","None","None","None","None","Dulu, warga Morowali di Sulteng jika ke Palu, menempuh 12 jam perjalanan darat 520 km. Ke Makassar yang lebih jauh, bisa naik kapal laut. Sekarang, mereka punya pilihan setelah Bandara Morowali beroperasi. Dari Morowali, naik pesawat ke Kendari tak sampai satu jam.","","None","",10708,"None","None","None","2018-12-26 01:41","None","None","None","None","None",668,"","1077741054571376640","","positive",2397,"Joko Widodo","jokowi"
"None","None","Kepada segenap umat Kristiani di mana pun berada, semoga perayaan Natal tahun ini membawa damai di hati kita semua ...","None","None","None","None","None","None","None","Kepada segenap umat Kristiani di mana pun berada, semoga perayaan Natal tahun ini membawa damai di hati kita semua ...","","None","",17999,"None","None","None","2018-12-25 04:05","None","None","None","None","None",1072,"","1077415042356633601","","positive",6822,"Joko Widodo","jokowi"
