"user_statuses_count","user_followers_count","full_text","user_url","user_location","user_description","user_profile_image_url_https","is_quote_status","quote_count","user_friends_count","full_text_norm","entities_user_mentions","entities_urls","in_reply_to_user_id_str","favorite_count","lang","user_created_at","user_listed_count","created_at","user_id_str","user_favourites_count","user_verified","source","in_reply_to_status_id_str","reply_count","in_reply_to_screen_name","id_str","entities_hashtags","text_sentiment","retweet_count","user_name","user_screen_name"
"None","None","Di antara perempuan-perempuan perkasa ...","None","None","None","None","None","None","None","Di antara perempuan-perempuan perkasa ...","","None","",45471,"None","None","None","2019-06-29 03:11","None","None","None","None","None",2225,"","1144805609486766080","","neutral",6981,"Joko Widodo","jokowi"
"None","None","Sebelum jamuan santap malam untuk para pemimpin negara-negara anggota G20, bersama Presiden Prancis Emmanuel Macron dan Ibu Brigitte Trogneux Macron di Osaka Geihinkan.","None","None","None","None","None","None","None","Sebelum jamuan santap malam untuk para pemimpin negara-negara anggota G20, bersama Presiden Prancis Emmanuel Macron dan Ibu Brigitte Trogneux Macron di Osaka Geihinkan.","","None","",15178,"None","None","None","2019-06-29 01:29","None","None","None","None","None",331,"","1144779930544168961","","neutral",1845,"Joko Widodo","jokowi"
"None","None","Bersama seluruh pemimpin negara ekonomi terbesar dunia di panggung KTT G20 di INTEX Osaka, Jepang, siang tadi. Di sini, para kepala negara, pemerintahan, serta lembaga dunia yang saya temui juga menyampaikan selamat atas keberhasilan penyelenggaraan Pemilu 2019 di Indonesia.","None","None","None","None","None","None","None","Bersama seluruh pemimpin negara ekonomi terbesar dunia di panggung KTT G20 di INTEX Osaka, Jepang, siang tadi. Di sini, para kepala negara, pemerintahan, serta lembaga dunia yang saya temui juga menyampaikan selamat atas keberhasilan penyelenggaraan Pemilu 2019 di Indonesia.","","None","",19034,"None","None","None","2019-06-28 11:38","None","None","None","None","None",633,"","1144570841478230016","","positive",3341,"Joko Widodo","jokowi"
"None","None","Melangkah di atas karpet merah di panggung dan melewati deretan bendera negara G20 di INTEX Osaka, siang tadi, setiap pemimpin negara peserta KTT G20 disambut hangat oleh Perdana Menteri Jepang Shinzo Abe. Selamat datang di Osaka.","None","None","None","None","None","None","None","Melangkah di atas karpet merah di panggung dan melewati deretan bendera negara G20 di INTEX Osaka, siang tadi, setiap pemimpin negara peserta KTT G20 disambut hangat oleh Perdana Menteri Jepang Shinzo Abe. Selamat datang di Osaka.","","None","",21835,"None","None","None","2019-06-28 09:27","None","None","None","None","None",952,"","1144537852442640385","","positive",3312,"Joko Widodo","jokowi"
"None","None","Obrolan sejenak bersama para pemimpin negara G20 di ruang Leaders’ Area, gedung INTEX Osaka, Jepang, sambil menantikan sesi official welcome dan family photo. Presiden Amerika Serikat Donald Trump berbagi permen kepada yang lain ","None","None","None","None","None","None","None","Obrolan sejenak bersama para pemimpin negara G20 di ruang Leaders’ Area, gedung INTEX Osaka, Jepang, sambil menantikan sesi official welcome dan family photo. Presiden Amerika Serikat Donald Trump berbagi permen kepada yang lain ","","None","",18276,"None","None","None","2019-06-28 05:49","None","None","None","None","None",1126,"","1144482945249361921","","positive",2877,"Joko Widodo","jokowi"
"None","None","Alhamdulillah, tiba di Jepang, pagi ini, untuk hadir bersama para pemimpin negara-negara ekonomi terbesar dunia di KTT G20 di Osaka, 28-29 Juni 2019, Di KTT G20 ini saya akan berbicara tentang dua hal: inovasi di bidang ekonomi digital dan upaya mengatasi kesenjangan.","None","None","None","None","None","None","None","Alhamdulillah, tiba di Jepang, pagi ini, untuk hadir bersama para pemimpin negara-negara ekonomi terbesar dunia di KTT G20 di Osaka, 28-29 Juni 2019, Di KTT G20 ini saya akan berbicara tentang dua hal: inovasi di bidang ekonomi digital dan upaya mengatasi kesenjangan.","","None","",14964,"None","None","None","2019-06-28 05:35","None","None","None","None","None",427,"","1144479380757835776","","neutral",1928,"Joko Widodo","jokowi"
"None","None","Proses pesta demokrasi yang telah berlangsung beberapa bulan telah usai. Tidak ada lagi 01 dan 02, yang ada hanyalah persatuan Indonesia. Dan saya memastikan bahwa presiden dan wakil presiden terpilih adalah presiden dan wakil presiden bagi seluruh rakyat Indonesia.","None","None","None","None","None","None","None","Proses pesta demokrasi yang telah berlangsung beberapa bulan telah usai. Tidak ada lagi 01 dan 02, yang ada hanyalah persatuan Indonesia. Dan saya memastikan bahwa presiden dan wakil presiden terpilih adalah presiden dan wakil presiden bagi seluruh rakyat Indonesia.","","None","",36853,"None","None","None","2019-06-28 02:11","None","None","None","None","None",2448,"","1144428002287030272","","positive",9961,"Joko Widodo","jokowi"
"None","None","Argentina adalah mitra perdagangan besar Indonesia di Amerika Selatan. Kepada Presiden Mauricio Macri yang datang kemarin, saya menawarkan produk dan jasa industri strategis Indonesia, dari pesawat, jasa pemeliharaan pesawat, lokomotif dan gerbong kereta sampai hasil pertanian.","None","None","None","None","None","None","None","Argentina adalah mitra perdagangan besar Indonesia di Amerika Selatan. Kepada Presiden Mauricio Macri yang datang kemarin, saya menawarkan produk dan jasa industri strategis Indonesia, dari pesawat, jasa pemeliharaan pesawat, lokomotif dan gerbong kereta sampai hasil pertanian.","","None","",11282,"None","None","None","2019-06-27 02:51","None","None","None","None","None",284,"","1144075694567112704","","positive",1237,"Joko Widodo","jokowi"
"None","None","Jersey timnas Argentina dari Presiden Argentina Mauricio Macri yang berkunjung ke Indonesia, hari ini. Sementara saya, menghadiahkan bola sepak buatan Indonesia. Kami bertukar cenderamata seusai pertemuan bilateral di Istana Bogor. Selamat datang Presiden Mauricio Macri.","None","None","None","None","None","None","None","Jersey timnas Argentina dari Presiden Argentina Mauricio Macri yang berkunjung ke Indonesia, hari ini. Sementara saya, menghadiahkan bola sepak buatan Indonesia. Kami bertukar cenderamata seusai pertemuan bilateral di Istana Bogor. Selamat datang Presiden Mauricio Macri.","","None","",14984,"None","None","None","2019-06-26 13:01","None","None","None","None","None",571,"","1143866852784791554","","negative",2335,"Joko Widodo","jokowi"
"None","None","Selama 12 tahun ini, kontingen TNI AD selalu menjuarai lomba tembak bergengsi di berbagai kompetisi dengan senjata buatan dalam negeri. Ya, senapan mesin, pistol, senjata berat, bahkan panser dan tank sudah lama diproduksi PT Pindad, BUMN Industri Strategis Indonesia.","None","None","None","None","None","None","None","Selama 12 tahun ini, kontingen TNI AD selalu menjuarai lomba tembak bergengsi di berbagai kompetisi dengan senjata buatan dalam negeri. Ya, senapan mesin, pistol, senjata berat, bahkan panser dan tank sudah lama diproduksi PT Pindad, BUMN Industri Strategis Indonesia.","","None","",19656,"None","None","None","2019-06-26 07:14","None","None","None","None","None",552,"","1143779559701020672","","negative",3435,"Joko Widodo","jokowi"
"None","None","Lagu The ASEAN Way dinyanyikan dan penampilan budaya berjudul Vivid ASEAN disuguhkan pagi ini di Hotel Athenee, Bangkok. Saya menyambut Anda sekalian di Kerajaan Thailand, tempat lahirnya ASEAN, kata PM Thailand Prayut Chan-o-cha. KTT ke-34 ASEAN pun resmi dibuka.","None","None","None","None","None","None","None","Lagu The ASEAN Way dinyanyikan dan penampilan budaya berjudul Vivid ASEAN disuguhkan pagi ini di Hotel Athenee, Bangkok. Saya menyambut Anda sekalian di Kerajaan Thailand, tempat lahirnya ASEAN, kata PM Thailand Prayut Chan-o-cha. KTT ke-34 ASEAN pun resmi dibuka.","","None","",11039,"None","None","None","2019-06-23 11:39","None","None","None","None","None",215,"","1142759184691150848","","positive",1159,"Joko Widodo","jokowi"
"None","None","Obrolan sejenak bersama Perdana Menteri Singapura Lee Hsien Loong sebelum menghadiri pleno KTT ke-34 ASEAN di Hotel Athenee Bangkok, kemarin. Kami hanya bicara soal rencana pertemuan leaders’ retreat di Singapura awal bulan Desember nanti.","None","None","None","None","None","None","None","Obrolan sejenak bersama Perdana Menteri Singapura Lee Hsien Loong sebelum menghadiri pleno KTT ke-34 ASEAN di Hotel Athenee Bangkok, kemarin. Kami hanya bicara soal rencana pertemuan leaders’ retreat di Singapura awal bulan Desember nanti.","","None","",10188,"None","None","None","2019-06-23 04:08","None","None","None","None","None",337,"","1142645623193083905","","neutral",1114,"Joko Widodo","jokowi"
"None","None","Akhir pekan yang padat di Bangkok. Kemarin sore, seusai beberapa pertemuan bilateral, saya hadir di Pertemuan Pemimpin ASEAN dengan ASEAN Business Advisory Council, lalu Perwakilan Pemuda ASEAN, AIPA, juga Pleno KTT di mana saya menyampaikan Outlook ASEAN mengenai Indo-Pasifik.","None","None","None","None","None","None","None","Akhir pekan yang padat di Bangkok. Kemarin sore, seusai beberapa pertemuan bilateral, saya hadir di Pertemuan Pemimpin ASEAN dengan ASEAN Business Advisory Council, lalu Perwakilan Pemuda ASEAN, AIPA, juga Pleno KTT di mana saya menyampaikan Outlook ASEAN mengenai Indo-Pasifik.","","None","",10524,"None","None","None","2019-06-23 02:33","None","None","None","None","None",278,"","1142621719238074369","","negative",1059,"Joko Widodo","jokowi"
"None","None","Bertemu Perdana Menteri Viet Nam Nguyen Xuan Phuc di Bangkok tadi, kami saling menyelamati: PM Viet Nam menyampaikan ucapan selamat atas proses dan hasil Pemilu di Indonesia, dan saya menyampaikan selamat kepada Viet Nam yang akan menjadi negara anggota DK PBB pada 2020-2021.","None","None","None","None","None","None","None","Bertemu Perdana Menteri Viet Nam Nguyen Xuan Phuc di Bangkok tadi, kami saling menyelamati: PM Viet Nam menyampaikan ucapan selamat atas proses dan hasil Pemilu di Indonesia, dan saya menyampaikan selamat kepada Viet Nam yang akan menjadi negara anggota DK PBB pada 2020-2021.","","None","",8275,"None","None","None","2019-06-22 13:41","None","None","None","None","None",184,"","1142427479828623360","","positive",788,"Joko Widodo","jokowi"
"None","None","Bertemu Aung San Suu Kyi, State Counsellor Republik Uni Myanmar yang juga menghadiri KTT ke-34 ASEAN, beberapa jam setiba di Bangkok siang tadi. Topik pembicaraan kami tentu tak jauh-jauh dari isu Rakhine State yang semenjak dulu telah menjadi perhatian kita.","None","None","None","None","None","None","None","Bertemu Aung San Suu Kyi, State Counsellor Republik Uni Myanmar yang juga menghadiri KTT ke-34 ASEAN, beberapa jam setiba di Bangkok siang tadi. Topik pembicaraan kami tentu tak jauh-jauh dari isu Rakhine State yang semenjak dulu telah menjadi perhatian kita.","","None","",7922,"None","None","None","2019-06-22 12:31","None","None","None","None","None",191,"","1142409857812713472","","positive",891,"Joko Widodo","jokowi"
"None","None","Bertolak menuju Bangkok pagi ini untuk menghadiri KTT ke-34 ASEAN. KTT ini akan berlangsung selama dua hari dengan agenda yang padat. Mohon doa dari seluruh rakyat agar perjalanan ini lancar.","None","None","None","None","None","None","None","Bertolak menuju Bangkok pagi ini untuk menghadiri KTT ke-34 ASEAN. KTT ini akan berlangsung selama dua hari dengan agenda yang padat. Mohon doa dari seluruh rakyat agar perjalanan ini lancar.","","None","",18508,"None","None","None","2019-06-22 06:05","None","None","None","None","None",980,"","1142312530036981760","","neutral",1916,"Joko Widodo","jokowi"
"None","None","Menjelang salat Jumat tadi, saya ke sini: meninjau perkembangan pembangunan landas pacu ketiga Bandara Internasional Soekarno-Hatta di Tangerang. Dan saya senang, landas pacu ini sudah hampir selesai. Semoga bulan Juli nanti, sudah bisa dioperasikan.","None","None","None","None","None","None","None","Menjelang salat Jumat tadi, saya ke sini: meninjau perkembangan pembangunan landas pacu ketiga Bandara Internasional Soekarno-Hatta di Tangerang. Dan saya senang, landas pacu ini sudah hampir selesai. Semoga bulan Juli nanti, sudah bisa dioperasikan.","","None","",11802,"None","None","None","2019-06-21 11:11","None","None","None","None","None",418,"","1142027229049737216","","neutral",1193,"Joko Widodo","jokowi"
"None","None","Terima kasih untuk segala perhatian, doa, dukungan, dan amanah yang tercurah dari seluruh rakyat kepada saya dan keluarga. Saya tak pernah merayakan hari ulang tahun, dan tak perlu ada pesta, kecuali rasa syukur ke hadirat Allah SWT, dan negeri yang menanti kerja bersama kita.","None","None","None","None","None","None","None","Terima kasih untuk segala perhatian, doa, dukungan, dan amanah yang tercurah dari seluruh rakyat kepada saya dan keluarga. Saya tak pernah merayakan hari ulang tahun, dan tak perlu ada pesta, kecuali rasa syukur ke hadirat Allah SWT, dan negeri yang menanti kerja bersama kita.","","None","",80939,"None","None","None","2019-06-21 03:43","None","None","None","None","None",10607,"","1141914554122637312","","positive",21431,"Joko Widodo","jokowi"
"None","None","Menyerahkan 3.200 lembar sertifikat hak atas tanah bagi masyarakat Gresik di GOR Tridharma Petrokimia siang tadi. Di seluruh Jawa Timur, dari 19.498.377 bidang tanah, 54,45 % di antaranya sudah bersertifikat.","None","None","None","None","None","None","None","Menyerahkan 3.200 lembar sertifikat hak atas tanah bagi masyarakat Gresik di GOR Tridharma Petrokimia siang tadi. Di seluruh Jawa Timur, dari 19.498.377 bidang tanah, 54,45 % di antaranya sudah bersertifikat.","","None","",9712,"None","None","None","2019-06-20 12:18","None","None","None","None","None",603,"","1141681814831947776","","neutral",1092,"Joko Widodo","jokowi"
"None","None","Tiba di Bandar Udara Internasional Juanda, Sidoarjo, pagi ini untuk kunjungan kerja di Jawa Timur. Hari ini, saya menyerahkan ribuan sertifikat hak atas tanah untuk rakyat di Kabupaten Gresik.","None","None","None","None","None","None","None","Tiba di Bandar Udara Internasional Juanda, Sidoarjo, pagi ini untuk kunjungan kerja di Jawa Timur. Hari ini, saya menyerahkan ribuan sertifikat hak atas tanah untuk rakyat di Kabupaten Gresik.","","None","",12648,"None","None","None","2019-06-20 03:57","None","None","None","None","None",548,"","1141555759953485824","","neutral",1558,"Joko Widodo","jokowi"
"None","None","Jenis usaha mikro, kecil, dan menengah di Indonesia saat ini ada 62,9 juta unit usaha. Pemerintah tentu akan menyediakan fasilitas kepada UMKM-UMKM ini tetapi harus menimbang satu hal: jangan sampai fasilitas itu justru mematikan jiwa dan karakter kewirausahaan mereka.","None","None","None","None","None","None","None","Jenis usaha mikro, kecil, dan menengah di Indonesia saat ini ada 62,9 juta unit usaha. Pemerintah tentu akan menyediakan fasilitas kepada UMKM-UMKM ini tetapi harus menimbang satu hal: jangan sampai fasilitas itu justru mematikan jiwa dan karakter kewirausahaan mereka.","","None","",9645,"None","None","None","2019-06-19 01:51","None","None","None","None","None",303,"","1141161673497071617","","negative",1072,"Joko Widodo","jokowi"
"None","None","Ikut berpawai di pembukaan Pesta Kesenian Bali 2019, pesta yang mengusung tema Bayu Pramana. Napas kehidupan, yang memuliakan sumber daya angin.","None","None","None","None","None","None","None","Ikut berpawai di pembukaan Pesta Kesenian Bali 2019, pesta yang mengusung tema Bayu Pramana. Napas kehidupan, yang memuliakan sumber daya angin.","","None","",20047,"None","None","None","2019-06-17 09:28","None","None","None","None","None",467,"","1140551814472855552","","positive",2892,"Joko Widodo","jokowi"
"None","None","Dengan baju adat berwarna coklat, dipadukan dengan udeng, saput dan kamen ungu ini, saya menghadiri pembukaan Pesta Kesenian Bali 2019 di Denpasar, kemarin. Tidak sekadar hadir, saya dan Ibu Negara bahkan turut menjadi peserta pawai dengan naik mobil hias. Terima kasih, Bali.","None","None","None","None","None","None","None","Dengan baju adat berwarna coklat, dipadukan dengan udeng, saput dan kamen ungu ini, saya menghadiri pembukaan Pesta Kesenian Bali 2019 di Denpasar, kemarin. Tidak sekadar hadir, saya dan Ibu Negara bahkan turut menjadi peserta pawai dengan naik mobil hias. Terima kasih, Bali.","","None","",16301,"None","None","None","2019-06-16 01:09","None","None","None","None","None",414,"","1140063722339098624","","positive",2184,"Joko Widodo","jokowi"
"None","None","Menyusuri tanggul Waduk Muara Nusa Dua, Denpasar, kemarin. Seiring meningkatnya kegiatan pariwisata di Kuta, Tanjung Benoa, dan Nusa Dua, maka pemerintah menata dan merehabilitasinya pada 2017 lalu. Jika rampung akhir 2019, Waduk Muara Nusa Dua juga akan jadi tempat wisata.","None","None","None","None","None","None","None","Menyusuri tanggul Waduk Muara Nusa Dua, Denpasar, kemarin. Seiring meningkatnya kegiatan pariwisata di Kuta, Tanjung Benoa, dan Nusa Dua, maka pemerintah menata dan merehabilitasinya pada 2017 lalu. Jika rampung akhir 2019, Waduk Muara Nusa Dua juga akan jadi tempat wisata.","","None","",8977,"None","None","None","2019-06-15 04:48","None","None","None","None","None",239,"","1139756640209526784","","neutral",979,"Joko Widodo","jokowi"
"None","None","Bermain bola dengan Jan Ethes di atas hamparan pasir Pantai Sanur, Bali.","None","None","None","None","None","None","None","Bermain bola dengan Jan Ethes di atas hamparan pasir Pantai Sanur, Bali.","","None","",32978,"None","None","None","2019-06-15 01:01","None","None","None","None","None",1078,"","1139699452669677569","","neutral",5070,"Joko Widodo","jokowi"
"None","None","Sebanyak 3.000 lembar sertifikat hak atas tanah saya serahkan hari ini kepada masyarakat dari tujuh kota dan kabupaten di Provinsi Bali. Yang menggembirakan, Bali akan jadi provinsi pertama di Indonesia yang seluruh bidang tanahnya bersertifikat tuntas tahun ini. Alhamdulillah.","None","None","None","None","None","None","None","Sebanyak 3.000 lembar sertifikat hak atas tanah saya serahkan hari ini kepada masyarakat dari tujuh kota dan kabupaten di Provinsi Bali. Yang menggembirakan, Bali akan jadi provinsi pertama di Indonesia yang seluruh bidang tanahnya bersertifikat tuntas tahun ini. Alhamdulillah.","","None","",10864,"None","None","None","2019-06-14 11:42","None","None","None","None","None",355,"","1139498401945362433","","neutral",1500,"Joko Widodo","jokowi"
"None","None","Selama tujuh bulan masa kampanye kemarin, kegiatan bagi-bagi sepeda dilarang. Pada acara pembagian sertifikat tanah di Bali, hari ini, saya kembali membagi sepeda untuk mereka yang bisa menjawab pertanyaan. Jadi, selamat kepada pemenang: menerima sertifikat, dapat sepeda pula.","None","None","None","None","None","None","None","Selama tujuh bulan masa kampanye kemarin, kegiatan bagi-bagi sepeda dilarang. Pada acara pembagian sertifikat tanah di Bali, hari ini, saya kembali membagi sepeda untuk mereka yang bisa menjawab pertanyaan. Jadi, selamat kepada pemenang: menerima sertifikat, dapat sepeda pula.","","None","",9998,"None","None","None","2019-06-14 09:38","None","None","None","None","None",442,"","1139467130485665794","","positive",1254,"Joko Widodo","jokowi"
"None","None","Dalam lima tahun ini, kita telah membangun lebih dari 5.000 pasar besar dan sekitar 8.900 pasar desa. Ke depan, target pemerintah masih sama. Pasar-pasar di seluruh Indonesia harus hidup sebagai tempat bertemunya penjual dan pembeli, produk-produk petani, nelayan, pengrajin.","None","None","None","None","None","None","None","Dalam lima tahun ini, kita telah membangun lebih dari 5.000 pasar besar dan sekitar 8.900 pasar desa. Ke depan, target pemerintah masih sama. Pasar-pasar di seluruh Indonesia harus hidup sebagai tempat bertemunya penjual dan pembeli, produk-produk petani, nelayan, pengrajin.","","None","",7416,"None","None","None","2019-06-14 07:03","None","None","None","None","None",266,"","1139428034581164032","","positive",921,"Joko Widodo","jokowi"
"None","None","Sesaat setelah meninjau Pasar Sukawati, seorang pria mencegat saya di jalan keluar. Di tangannya ada selembar kertas. Ternyata itu foto saya. Rupanya, ia ingin meminta tanda tangan. Katanya untuk kenang-kenangan. Maka berbantalkan punggung ajudan, foto itu saya tanda tangani.","None","None","None","None","None","None","None","Sesaat setelah meninjau Pasar Sukawati, seorang pria mencegat saya di jalan keluar. Di tangannya ada selembar kertas. Ternyata itu foto saya. Rupanya, ia ingin meminta tanda tangan. Katanya untuk kenang-kenangan. Maka berbantalkan punggung ajudan, foto itu saya tanda tangani.","","None","",20839,"None","None","None","2019-06-14 04:44","None","None","None","None","None",826,"","1139393177880649734","","negative",2762,"Joko Widodo","jokowi"
"None","None","Anda yang ke Bali dan belum ke Pasar Sukawati, itu rasanya belum ke Bali. Pasar seni di Gianyar ini adalah pusat kerajinan seni khas Bali. Sukawati akan direvitalisasi menjadi pasar rakyat yang modern. Jika lancar, wajah dan suasana baru Pasar Sukawati akan rampung tahun depan.","None","None","None","None","None","None","None","Anda yang ke Bali dan belum ke Pasar Sukawati, itu rasanya belum ke Bali. Pasar seni di Gianyar ini adalah pusat kerajinan seni khas Bali. Sukawati akan direvitalisasi menjadi pasar rakyat yang modern. Jika lancar, wajah dan suasana baru Pasar Sukawati akan rampung tahun depan.","","None","",8007,"None","None","None","2019-06-14 04:06","None","None","None","None","None",223,"","1139383566645653505","","positive",1001,"Joko Widodo","jokowi"
"None","None","Mendarat di Bandara I Gusti Ngurah Rai di Bali, semalam. Hari ini, Insya Allah, saya hendak bertemu dan menyerahkan sertifikat hak atas tanah kepada masyarakat di Kabupaten Bangli. Setelah itu, meninjau kawasan wisata Waduk Muara Nusa Dua di Kota Denpasar. Selamat pagi.","None","None","None","None","None","None","None","Mendarat di Bandara I Gusti Ngurah Rai di Bali, semalam. Hari ini, Insya Allah, saya hendak bertemu dan menyerahkan sertifikat hak atas tanah kepada masyarakat di Kabupaten Bangli. Setelah itu, meninjau kawasan wisata Waduk Muara Nusa Dua di Kota Denpasar. Selamat pagi.","","None","",11346,"None","None","None","2019-06-14 01:40","None","None","None","None","None",392,"","1139346949260206081","","neutral",1276,"Joko Widodo","jokowi"
"None","None","Perang dagang Amerika Serikat dan Tiongkok yang menimbulkan gejolak perekonomian global bisa jadi peluang bagi Indonesia. Saat tarif bea masuk terhadap produk Tiongkok dinaikkan oleh AS, para pengusaha bisa manfaatkan peluang ini dengan memperbesar ekspor ke AS.","None","None","None","None","None","None","None","Perang dagang Amerika Serikat dan Tiongkok yang menimbulkan gejolak perekonomian global bisa jadi peluang bagi Indonesia. Saat tarif bea masuk terhadap produk Tiongkok dinaikkan oleh AS, para pengusaha bisa manfaatkan peluang ini dengan memperbesar ekspor ke AS.","","None","",11495,"None","None","None","2019-06-13 02:08","None","None","None","None","None",515,"","1138991377927135232","","negative",1745,"Joko Widodo","jokowi"
"None","None","Selamat kepada Pak Arinal Djunaidi dan Bu Chusnunia yang hari ini resmi menjadi Gubernur dan Wakil Gubernur Lampung periode 2019-2024. Selamat bekerja.","None","None","None","None","None","None","None","Selamat kepada Pak Arinal Djunaidi dan Bu Chusnunia yang hari ini resmi menjadi Gubernur dan Wakil Gubernur Lampung periode 2019-2024. Selamat bekerja.","","None","",10684,"None","None","None","2019-06-12 09:05","None","None","None","None","None",228,"","1138734098808131584","","positive",1273,"Joko Widodo","jokowi"
"None","None","Senang sekali menerima Pak Jusuf Kalla siang ini di istana. Selain berdiskusi tentang pekerjaan, Pak JK berbagi cerita tentang Lebaran kemarin: apa yang beliau lakukan, makanan favorit, juga tentang cucu-cucunya. Inilah cerita Lebaran Pak JK.","None","None","None","None","None","None","None","Senang sekali menerima Pak Jusuf Kalla siang ini di istana. Selain berdiskusi tentang pekerjaan, Pak JK berbagi cerita tentang Lebaran kemarin: apa yang beliau lakukan, makanan favorit, juga tentang cucu-cucunya. Inilah cerita Lebaran Pak JK.","","None","",23018,"None","None","None","2019-06-11 13:52","None","None","None","None","None",824,"","1138443983661568000","","positive",3397,"Joko Widodo","jokowi"
"None","None","Selamat siang, Indonesia. Libur Lebaran usai sudah. Saatnya kembali bekerja.","None","None","None","None","None","None","None","Selamat siang, Indonesia. Libur Lebaran usai sudah. Saatnya kembali bekerja.","","None","",28696,"None","None","None","2019-06-10 05:46","None","None","None","None","None",1445,"","1137959130553962496","","neutral",4946,"Joko Widodo","jokowi"
"None","None","Berbelanja alat dapur dan aneka buah di Pasar Gede Solo yang sedang ramai pengunjung pagi tadi. Belanjaannya berat, tapi tak apa. Ada Gibran dan @KaesangP yang sigap bantu mengangkatnya ","None","None","None","None","None","None","None","Berbelanja alat dapur dan aneka buah di Pasar Gede Solo yang sedang ramai pengunjung pagi tadi. Belanjaannya berat, tapi tak apa. Ada Gibran dan @KaesangP yang sigap bantu mengangkatnya ","KaesangP","None","",26397,"None","None","None","2019-06-09 09:54","None","None","None","None","None",1748,"","1137659221917310976","","positive",4056,"Joko Widodo","jokowi"
