"user_statuses_count","user_followers_count","full_text","user_url","user_location","user_description","user_profile_image_url_https","is_quote_status","quote_count","user_friends_count","full_text_norm","entities_user_mentions","entities_urls","in_reply_to_user_id_str","favorite_count","lang","user_created_at","user_listed_count","created_at","user_id_str","user_favourites_count","user_verified","source","in_reply_to_status_id_str","reply_count","in_reply_to_screen_name","id_str","entities_hashtags","text_sentiment","retweet_count","user_name","user_screen_name"
"None","None","Yang kita perjuangankan bukan untuk kepentingan pribadi atau golongan mana pun. Kita bergerak dan berjuang bersama untuk terwujudnya keadilan sosial bagi seluruh rakyat Indonesia. #PrabowoMenyapaJateng","None","None","None","None","None","None","None","Yang kita perjuangankan bukan untuk kepentingan pribadi atau golongan mana pun. Kita bergerak dan berjuang bersama untuk terwujudnya keadilan sosial bagi seluruh rakyat Indonesia. #PrabowoMenyapaJateng","","None","",7752,"None","None","None","2019-02-13 08:51","None","None","None","None","None",720,"","1095606491954917376","PrabowoMenyapaJateng","neutral",2148,"Prabowo Subianto","prabowo"
"None","None","Salam untuk istrinya, semoga sehat selalu dan semuanya berjalan lancar.","None","None","None","None","None","None","None","Salam untuk istrinya, semoga sehat selalu dan semuanya berjalan lancar.","","None","1054713941518049280",77,"None","None","None","2019-02-13 08:49","None","None","None","None","None",3,"SamberGledek11","1095605852185088000","","positive",8,"Prabowo Subianto","prabowo"
"None","None","Pesan dari Ibu Suci, pensiunan guru di Purbalingga. Terima kasih atas pesannya, insya Allah kita akan berikan yang terbaik bagi seluruh rakyat Indonesia. #PrabowoMenyapaJateng","None","None","None","None","None","None","None","Pesan dari Ibu Suci, pensiunan guru di Purbalingga. Terima kasih atas pesannya, insya Allah kita akan berikan yang terbaik bagi seluruh rakyat Indonesia. #PrabowoMenyapaJateng","","None","",10746,"None","None","None","2019-02-13 08:27","None","None","None","None","None",546,"","1095600369747390465","PrabowoMenyapaJateng","positive",2947,"Prabowo Subianto","prabowo"
"None","None","Insya Allah. Mari kita saling mengingatkan.","None","None","None","None","None","None","None","Insya Allah. Mari kita saling mengingatkan.","","None","",4162,"None","None","None","2019-02-13 08:12","None","None","None","None","None",266,"","1095596532651290626","","neutral",781,"Prabowo Subianto","prabowo"
"None","None","Terima kasih kepada warga Purbalingga dan Banjarnegara atas sambutan yang luar biasa. Melalui pemilu 2019 bersama-sama bergerak kita wujudkan kebangkitan kembali bangsa Indonesia. #PrabowoMenyapaJateng","None","None","None","None","None","None","None","Terima kasih kepada warga Purbalingga dan Banjarnegara atas sambutan yang luar biasa. Melalui pemilu 2019 bersama-sama bergerak kita wujudkan kebangkitan kembali bangsa Indonesia. #PrabowoMenyapaJateng","","None","",11195,"None","None","None","2019-02-13 07:50","None","None","None","None","None",704,"","1095591102327939073","PrabowoMenyapaJateng","positive",3313,"Prabowo Subianto","prabowo"
"None","None","Terima kasih atas dukunganmu. Salam hormat untuk keluarga. Kita bangun bangsa ini bersama-sama.","None","None","None","None","None","None","None","Terima kasih atas dukunganmu. Salam hormat untuk keluarga. Kita bangun bangsa ini bersama-sama.","","None","1084748615208189952",550,"None","None","None","2019-02-13 03:03","None","None","None","None","None",41,"EccoKunarko","1095518685542793216","","positive",36,"Prabowo Subianto","prabowo"
"None","None","Mohon sampaikan informasi yang lengkap. Misal, kabupaten atau kota, kecamatan.","None","None","None","None","None","None","None","Mohon sampaikan informasi yang lengkap. Misal, kabupaten atau kota, kecamatan.","","None","",262,"None","None","None","2019-02-13 03:00","None","None","None","None","None",26,"","1095518032820985856","","neutral",17,"Prabowo Subianto","prabowo"
"None","None","Beberapa bulan lalu saya menyapa Pekalongan, belanja dan belajar mbatik juga.","None","None","None","None","None","None","None","Beberapa bulan lalu saya menyapa Pekalongan, belanja dan belajar mbatik juga.","","None","1076130493672742912 132041617",220,"None","None","None","2019-02-13 02:57","None","None","None","None","None",11,"BamNoorEsa sandiuno","1095517286394294272","","neutral",10,"Prabowo Subianto","prabowo"
"None","None","Assalammu’alaikum Wr. Wb. Adakah sahabat sekalian yang berasal dari Purbalingga, Jawa Tengah? Insya Allah, hari ini saya akan menyapa warga Purbalingga. #PrabowoMenyapaJateng","None","None","None","None","None","None","None","Assalammu’alaikum Wr. Wb. Adakah sahabat sekalian yang berasal dari Purbalingga, Jawa Tengah? Insya Allah, hari ini saya akan menyapa warga Purbalingga. #PrabowoMenyapaJateng","","None","",18842,"None","None","None","2019-02-13 02:22","None","None","None","None","None",2422,"","1095508379202547712","PrabowoMenyapaJateng","neutral",4155,"Prabowo Subianto","prabowo"
"None","None","Salam hormat saya buat bapakmu. Semoga kali ini masih percaya kepada saya.","None","None","None","None","None","None","None","Salam hormat saya buat bapakmu. Semoga kali ini masih percaya kepada saya.","","None","2727355295",31,"None","None","None","2019-02-06 06:51","None","None","None","None","None",7,"ini_akoe","1093039508373684226","","positive",3,"Prabowo Subianto","prabowo"
"None","None","Setiap orang punya penilaian, tapi rakyat yang merasakan apakah sekarang keadilan sosial telah terwujud?","None","None","None","None","None","None","None","Setiap orang punya penilaian, tapi rakyat yang merasakan apakah sekarang keadilan sosial telah terwujud?","","None","1067785690182692865",88,"None","None","None","2019-02-06 06:44","None","None","None","None","None",17,"Pangalengge1","1093037714964762624","","neutral",27,"Prabowo Subianto","prabowo"
"None","None","Aamiin.","None","None","None","None","None","None","None","Aamiin.","","None","974841321033687042",28,"None","None","None","2019-02-06 06:39","None","None","None","None","None",2,"Imannursapa2","1093036438969507840","","neutral",2,"Prabowo Subianto","prabowo"
"None","None","Kita memerlukan anak bangsa yang sudah mapan untuk berjuang di politik dengan harapan mereka mengabdi bukan cari uang. Selama hukum menjadi panglima tertinggi, adil untuk semua, tidak dilarang untuk menjadi kaya.","None","None","None","None","None","None","None","Kita memerlukan anak bangsa yang sudah mapan untuk berjuang di politik dengan harapan mereka mengabdi bukan cari uang. Selama hukum menjadi panglima tertinggi, adil untuk semua, tidak dilarang untuk menjadi kaya.","","None","1067098578215043072",58,"None","None","None","2019-02-06 06:38","None","None","None","None","None",9,"FahadMarzuki","1093036108537946112","","positive",25,"Prabowo Subianto","prabowo"
"None","None","Terima kasih atas kesetiaanmu, loyalitasmu, perjuanganmu. Terima kasih atas solidaritas dan kebersamaan, perjuangan dan pengorbananmu selama ini. Yakinlah kita akan membawa kemakmuran bagi rakyat dan kejayaan bagi bangsa Indonesia. #DirgahayuGerindra #KitaGerindra02","None","None","None","None","None","None","None","Terima kasih atas kesetiaanmu, loyalitasmu, perjuanganmu. Terima kasih atas solidaritas dan kebersamaan, perjuangan dan pengorbananmu selama ini. Yakinlah kita akan membawa kemakmuran bagi rakyat dan kejayaan bagi bangsa Indonesia. #DirgahayuGerindra #KitaGerindra02","","None","",6081,"None","None","None","2019-02-06 06:23","None","None","None","None","None",497,"","1093032367894126593","DirgahayuGerindra KitaGerindra02","positive",1277,"Prabowo Subianto","prabowo"
"None","None","Kita adalah pejuang yang yakin bahwa Negara ini mampu menyejahterakan rakyatnya. Kita adalah pejuang yang membela hak-hak dari rakyat yang menaruh kepercayaannya di pundak kita.","None","None","None","None","None","None","None","Kita adalah pejuang yang yakin bahwa Negara ini mampu menyejahterakan rakyatnya. Kita adalah pejuang yang membela hak-hak dari rakyat yang menaruh kepercayaannya di pundak kita.","","None","",4275,"None","None","None","2019-02-06 06:22","None","None","None","None","None",188,"","1093032180941344768","","positive",741,"Prabowo Subianto","prabowo"
"None","None","Kita sendiri-sendiri tidak ada artinya. Kita bersama-sama, lintas generasi, lintas profesi, beragam suku, bermacam agama bergerak seirama akan memberikan perubahan besar bagi rakyat dan bangsa. #DirgahayuGerindra #KitaGerindra02","None","None","None","None","None","None","None","Kita sendiri-sendiri tidak ada artinya. Kita bersama-sama, lintas generasi, lintas profesi, beragam suku, bermacam agama bergerak seirama akan memberikan perubahan besar bagi rakyat dan bangsa. #DirgahayuGerindra #KitaGerindra02","","None","",1653,"None","None","None","2019-02-06 06:20","None","None","None","None","None",60,"","1093031777755484160","DirgahayuGerindra KitaGerindra02","positive",355,"Prabowo Subianto","prabowo"
"None","None","Percayalah semakin dekat kita dengan tujuan, semakin berat hambatan yang akan kita lalui. #DirgahayuGerindra #KitaGerindra02","None","None","None","None","None","None","None","Percayalah semakin dekat kita dengan tujuan, semakin berat hambatan yang akan kita lalui. #DirgahayuGerindra #KitaGerindra02","","None","",3059,"None","None","None","2019-02-06 06:20","None","None","None","None","None",173,"","1093031620473368577","DirgahayuGerindra KitaGerindra02","negative",566,"Prabowo Subianto","prabowo"
"None","None","Namun dalam perjalanan mewujudkan amanat tersebut bukanlah jalan yang mudah. Kita diserang, dihujat dan fitnah, janganlah kita ambil hati. Jadilah seorang pendekar, yang tetap bergerak dan terus berjalan lurus berjuang demi Negara. #DirgahayuGerindra #KitaGerindra02","None","None","None","None","None","None","None","Namun dalam perjalanan mewujudkan amanat tersebut bukanlah jalan yang mudah. Kita diserang, dihujat dan fitnah, janganlah kita ambil hati. Jadilah seorang pendekar, yang tetap bergerak dan terus berjalan lurus berjuang demi Negara. #DirgahayuGerindra #KitaGerindra02","","None","",2252,"None","None","None","2019-02-06 06:19","None","None","None","None","None",332,"","1093031462960414720","DirgahayuGerindra KitaGerindra02","positive",403,"Prabowo Subianto","prabowo"
"None","None","Amanat yang diberikan harus kita jaga, dijalankan dengan amanah, semata-mata untuk berbakti dan melayani rakyat dan berbuat demi kemaslahatan orang banyak, bukan untuk mencari kekayaan pribadi atau keagungan diri. #DirgahayuGerindra #KitaGerindra02","None","None","None","None","None","None","None","Amanat yang diberikan harus kita jaga, dijalankan dengan amanah, semata-mata untuk berbakti dan melayani rakyat dan berbuat demi kemaslahatan orang banyak, bukan untuk mencari kekayaan pribadi atau keagungan diri. #DirgahayuGerindra #KitaGerindra02","","None","",1332,"None","None","None","2019-02-06 06:19","None","None","None","None","None",42,"","1093031311403474944","DirgahayuGerindra KitaGerindra02","positive",290,"Prabowo Subianto","prabowo"
"None","None","Kita meyakini, kekuasaan yang murni, kekuasaan yang langgeng adalah kekuasaan yang diamanatkan oleh rakyat dan diridhoi oleh Tuhan Yang Maha Besar, Allah SWT. #DirgahayuGerindra #KitaGerindra02","None","None","None","None","None","None","None","Kita meyakini, kekuasaan yang murni, kekuasaan yang langgeng adalah kekuasaan yang diamanatkan oleh rakyat dan diridhoi oleh Tuhan Yang Maha Besar, Allah SWT. #DirgahayuGerindra #KitaGerindra02","","None","",1458,"None","None","None","2019-02-06 06:18","None","None","None","None","None",47,"","1093031158118461440","DirgahayuGerindra KitaGerindra02","neutral",374,"Prabowo Subianto","prabowo"
"None","None","Sebagai pejuang politik, kita menyadari dengan berpolitik kita sedang berjuang, berkorban, bekerja untuk memperbaiki kehidupan rakyat dan bangsa. Dengan terjun ke politik kita paham hanya dengan berkuasa, perubahan nyata dapat kita wujudkan. #DirgahayuGerindra #KitaGerindra02","None","None","None","None","None","None","None","Sebagai pejuang politik, kita menyadari dengan berpolitik kita sedang berjuang, berkorban, bekerja untuk memperbaiki kehidupan rakyat dan bangsa. Dengan terjun ke politik kita paham hanya dengan berkuasa, perubahan nyata dapat kita wujudkan. #DirgahayuGerindra #KitaGerindra02","","None","",2130,"None","None","None","2019-02-06 06:17","None","None","None","None","None",76,"","1093030804945391616","DirgahayuGerindra KitaGerindra02","positive",380,"Prabowo Subianto","prabowo"
"None","None","Kita telah bersumpah setia menjaga Pancasila dan UUD 1945 dalam setiap jati diri kader Partai Gerindra. #DirgahayuGerindra #KitaGerindra02","None","None","None","None","None","None","None","Kita telah bersumpah setia menjaga Pancasila dan UUD 1945 dalam setiap jati diri kader Partai Gerindra. #DirgahayuGerindra #KitaGerindra02","","None","",1259,"None","None","None","2019-02-06 06:16","None","None","None","None","None",43,"","1093030531493552129","DirgahayuGerindra KitaGerindra02","positive",281,"Prabowo Subianto","prabowo"
"None","None","Sebelas tahun kita berhimpun dalam naungan panji Partai Gerindra. @Gerindra berdiri untuk membawa harapan baru. Gerindra berdiri untuk menjaga warisan dari cita-cita pendiri bangsa, agar setiap rakyat dan bangsa hidup terhormat, hidup makmur. #DirgahayuGerindra #KitaGerindra02","None","None","None","None","None","None","None","Sebelas tahun kita berhimpun dalam naungan panji Partai Gerindra. @Gerindra berdiri untuk membawa harapan baru. Gerindra berdiri untuk menjaga warisan dari cita-cita pendiri bangsa, agar setiap rakyat dan bangsa hidup terhormat, hidup makmur. #DirgahayuGerindra #KitaGerindra02","Gerindra","None","",7283,"None","None","None","2019-02-06 06:15","None","None","None","None","None",478,"","1093030322281705473","DirgahayuGerindra KitaGerindra02","positive",1756,"Prabowo Subianto","prabowo"
"None","None","Bung @TeddyGusnaidi, saya berdomisili di Indonesia. SKCK dari kepolisian saya punya. Setiap pengadilan dimasa lalu saya hadiri. Saya tidak kemana-mana. Setia berjuanh untuk rakyat.","None","None","None","None","None","None","None","Bung @TeddyGusnaidi, saya berdomisili di Indonesia. SKCK dari kepolisian saya punya. Setiap pengadilan dimasa lalu saya hadiri. Saya tidak kemana-mana. Setia berjuanh untuk rakyat.","TeddyGusnaidi","None","478546649",4044,"None","None","None","2019-02-05 06:19","None","None","None","None","None",923,"TeddyGusnaidi","1092668914910191617","","neutral",2002,"Prabowo Subianto","prabowo"
"None","None","Terima kasih. Luruskan niat perjuangan kita untuk Indonesia Adil dan Makmur.","None","None","None","None","None","None","None","Terima kasih. Luruskan niat perjuangan kita untuk Indonesia Adil dan Makmur.","","None","924759144 132041617",198,"None","None","None","2019-02-05 06:07","None","None","None","None","None",13,"JH_talk_2_U sandiuno","1092665946584444928","","positive",75,"Prabowo Subianto","prabowo"
"None","None","Selamat Tahun Baru Imlek 2570 bagi sahabat yang merayakan. Salam hormat saya untuk keluarga di rumah. Gong Xi Fa Cai.","None","None","None","None","None","None","None","Selamat Tahun Baru Imlek 2570 bagi sahabat yang merayakan. Salam hormat saya untuk keluarga di rumah. Gong Xi Fa Cai.","","None","",6636,"None","None","None","2019-02-05 05:24","None","None","None","None","None",354,"","1092655245493039104","","positive",1165,"Prabowo Subianto","prabowo"
"None","None","Tidur nyenyak malam ini setelah dapat pijatan dari @sandiuno","None","None","None","None","None","None","None","Tidur nyenyak malam ini setelah dapat pijatan dari @sandiuno","sandiuno","None","",27529,"None","None","None","2019-01-17 17:14","None","None","None","None","None",2545,"","1085948527040024577","","positive",6837,"Prabowo Subianto","prabowo"
"None","None","Saya dan @sandiuno mengucapkan terima kasih atas do’a dan dukungan dari semua pihak sehingga kegiatan malam ini berjalan baik. Semoga memberikan manfaat bagi demokrasi kita. Selamat beristirahat. Jangan merasa lelah berjuang, karena rakyat sudah terlalu menderita.","None","None","None","None","None","None","None","Saya dan @sandiuno mengucapkan terima kasih atas do’a dan dukungan dari semua pihak sehingga kegiatan malam ini berjalan baik. Semoga memberikan manfaat bagi demokrasi kita. Selamat beristirahat. Jangan merasa lelah berjuang, karena rakyat sudah terlalu menderita.","sandiuno","None","",26517,"None","None","None","2019-01-17 17:06","None","None","None","None","None",3005,"","1085946458505830400","","negative",7060,"Prabowo Subianto","prabowo"
"None","None","Turut berduka cita sedalam-dalamnya atas meninggalnya bung @nukman Seorang pegiat media sosial yang selalu memberikan hal positif bagi bangsa. Semoga keluarga yang ditinggalkan diberi kesabaran dan ketabahan.","None","None","None","None","None","None","None","Turut berduka cita sedalam-dalamnya atas meninggalnya bung @nukman Seorang pegiat media sosial yang selalu memberikan hal positif bagi bangsa. Semoga keluarga yang ditinggalkan diberi kesabaran dan ketabahan.","nukman","None","",10327,"None","None","None","2019-01-13 06:29","None","None","None","None","None",518,"","1084336672303529984","","neutral",1753,"Prabowo Subianto","prabowo"
"None","None","Doa saya untuk kesembuhan Ustad Arifin Ilham yang saat ini terbaring sakit. Tekad dan semangat beliau untuk sembuh sangat kuat, bahkan ditengah-tengah diskusi beliau sempat menunjukkan video berkuda kepada saya.","None","None","None","None","None","None","None","Doa saya untuk kesembuhan Ustad Arifin Ilham yang saat ini terbaring sakit. Tekad dan semangat beliau untuk sembuh sangat kuat, bahkan ditengah-tengah diskusi beliau sempat menunjukkan video berkuda kepada saya.","","None","",23238,"None","None","None","2019-01-09 09:50","None","None","None","None","None",1552,"","1082937725899042816","","neutral",6485,"Prabowo Subianto","prabowo"
"None","None","Ditengah kegembiraan kita, masih ada saudara-saudara kita yang tengah dilanda musibah mari kita panjatkan do’a agar Allah SWT memberikan kesabaran dan ketabahan bagi saudara kita. Aamiin. Selamat Tahun Baru 2019.","None","None","None","None","None","None","None","Ditengah kegembiraan kita, masih ada saudara-saudara kita yang tengah dilanda musibah mari kita panjatkan do’a agar Allah SWT memberikan kesabaran dan ketabahan bagi saudara kita. Aamiin. Selamat Tahun Baru 2019.","","None","",5103,"None","None","None","2018-12-31 17:31","None","None","None","None","None",444,"","1079792213352038400","","positive",970,"Prabowo Subianto","prabowo"
"None","None","Semoga di tahun 2019 ini kita semakin bersyukur, semakin rendah hati, semakin kerja keras untuk diri kita, keluarga kita, saudara-saudara kita dan untuk seluruh rakyat Indonesia.","None","None","None","None","None","None","None","Semoga di tahun 2019 ini kita semakin bersyukur, semakin rendah hati, semakin kerja keras untuk diri kita, keluarga kita, saudara-saudara kita dan untuk seluruh rakyat Indonesia.","","None","",4936,"None","None","None","2018-12-31 17:30","None","None","None","None","None",278,"","1079792035647770629","","negative",1005,"Prabowo Subianto","prabowo"
"None","None","Kita hadapi tahun baru dengan penuh optimis, penuh keyakinan bahwa tahun ini akan membawa kebaikan bagi kita semua dan kita bersyukur atas segala pemberian Allah SWT.","None","None","None","None","None","None","None","Kita hadapi tahun baru dengan penuh optimis, penuh keyakinan bahwa tahun ini akan membawa kebaikan bagi kita semua dan kita bersyukur atas segala pemberian Allah SWT.","","None","",2661,"None","None","None","2018-12-31 17:30","None","None","None","None","None",162,"","1079791888754868224","","positive",555,"Prabowo Subianto","prabowo"
"None","None","Kita bersyukur bahwa kita telah diberi kesehatan dan keselamatan oleh Allah SWT, Tuhan Yang Maha Kuasa sehingga kita bisa melewati tahun 2018 dan menyongsong tahun baru 2019.","None","None","None","None","None","None","None","Kita bersyukur bahwa kita telah diberi kesehatan dan keselamatan oleh Allah SWT, Tuhan Yang Maha Kuasa sehingga kita bisa melewati tahun 2018 dan menyongsong tahun baru 2019.","","None","",9802,"None","None","None","2018-12-31 17:29","None","None","None","None","None",666,"","1079791627512606725","","neutral",2146,"Prabowo Subianto","prabowo"
"None","None","Terima kasih sambutan yang luar biasa. Sampaikan salam untuk keluarga.","None","None","None","None","None","None","None","Terima kasih sambutan yang luar biasa. Sampaikan salam untuk keluarga.","","None","533364174",132,"None","None","None","2018-12-28 14:31","None","None","None","None","None",12,"ilyas_jaya","1078659603989065728","","positive",3,"Prabowo Subianto","prabowo"
"None","None","Insya Allah, lain waktu. Tetap semangat.","None","None","None","None","None","None","None","Insya Allah, lain waktu. Tetap semangat.","","None","72780820",130,"None","None","None","2018-12-28 14:30","None","None","None","None","None",13,"fairiz_taqy","1078659354650267648","","positive",3,"Prabowo Subianto","prabowo"
"None","None","Lakukan dan berikan yang terbaik untuk keinginanmu. Jangan lupa berdo’a.","None","None","None","None","None","None","None","Lakukan dan berikan yang terbaik untuk keinginanmu. Jangan lupa berdo’a.","","None","3308687323",96,"None","None","None","2018-12-28 14:28","None","None","None","None","None",4,"ASEAN_GarisLucu","1078658977741717506","","positive",22,"Prabowo Subianto","prabowo"
"None","None","Disambut dengan meriah, dengan senyum, diterima dengan ramah, sudah senang sekali hati ini. Walau dalam hati berharap dukungan, kita bekerja dan berdo’a kepada Allah SWT, Tuhan Yang Maha Kuasa.","None","None","None","None","None","None","None","Disambut dengan meriah, dengan senyum, diterima dengan ramah, sudah senang sekali hati ini. Walau dalam hati berharap dukungan, kita bekerja dan berdo’a kepada Allah SWT, Tuhan Yang Maha Kuasa.","","None","3408965892",239,"None","None","None","2018-12-28 14:24","None","None","None","None","None",16,"jmtransindo","1078657966755131393","","positive",20,"Prabowo Subianto","prabowo"
"None","None","Saya berpartai adalah agar saya tetap bisa berperan aktif untuk mewujudkan keadilan dan kemakmuran bagi seluruh rakyat, apakah cukup? Belum cukup. Sekarang saya ikut sebagai peserta pemilu agar bisa berperan dan berdampak lebih luas.","None","None","None","None","None","None","None","Saya berpartai adalah agar saya tetap bisa berperan aktif untuk mewujudkan keadilan dan kemakmuran bagi seluruh rakyat, apakah cukup? Belum cukup. Sekarang saya ikut sebagai peserta pemilu agar bisa berperan dan berdampak lebih luas.","","None","1022831591351967744",696,"None","None","None","2018-12-28 14:19","None","None","None","None","None",53,"Pasut_owel","1078656723722764288","","positive",182,"Prabowo Subianto","prabowo"
"None","None","Insya Allah. Hukum harus menjadi panglima tertinggi di Republik Indonesia.","None","None","None","None","None","None","None","Insya Allah. Hukum harus menjadi panglima tertinggi di Republik Indonesia.","","None","2701169514 2519832906",405,"None","None","None","2018-12-28 14:06","None","None","None","None","None",47,"aburasyid13 MbahUyok","1078653334406352898","","neutral",106,"Prabowo Subianto","prabowo"
"None","None","Sayang sekali fotonya burem, semoga lain kesempatan bisa lebih baik.","None","None","None","None","None","None","None","Sayang sekali fotonya burem, semoga lain kesempatan bisa lebih baik.","","None","533364174",47,"None","None","None","2018-12-28 14:03","None","None","None","None","None",0,"ilyas_jaya","1078652623618625537","","positive",2,"Prabowo Subianto","prabowo"
"None","None","Terima kasih!!","None","None","None","None","None","None","None","Terima kasih!!","","None","1078460477884121089",25,"None","None","None","2018-12-28 14:00","None","None","None","None","None",1,"HammurabiAif","1078651960901828609","","positive",1,"Prabowo Subianto","prabowo"
"None","None","Semua kekuasaan untuk penegakan hukum sudah jelas siapa. Silahkan tanyakan langsung.","None","None","None","None","None","None","None","Semua kekuasaan untuk penegakan hukum sudah jelas siapa. Silahkan tanyakan langsung.","","None","941572277392392193",18,"None","None","None","2018-12-28 14:00","None","None","None","None","None",2,"GarisPutihku","1078651786968190976","","positive",1,"Prabowo Subianto","prabowo"
"None","None","Sabar bung, jangan emosi. Mari kita jadikan sosial media sarana berdiskusi sehat dengan tenang tanpa makian atau kata kasar.","None","None","None","None","None","None","None","Sabar bung, jangan emosi. Mari kita jadikan sosial media sarana berdiskusi sehat dengan tenang tanpa makian atau kata kasar.","","None","4497140836",20,"None","None","None","2018-12-28 13:57","None","None","None","None","None",2,"fatih_bintoro","1078651180752920577","","positive",2,"Prabowo Subianto","prabowo"
"None","None","Aamiin. Terima kasih.","None","None","None","None","None","None","None","Aamiin. Terima kasih.","","None","848711079735681024",39,"None","None","None","2018-12-28 13:55","None","None","None","None","None",0,"Zendri77403828","1078650749951733761","","neutral",7,"Prabowo Subianto","prabowo"
"None","None","Menarik ini. “Mau presiden baru, atau mau ganti presiden?” Biarlah rakyat menentukan pilihannya untuk nasib mereka, keluarga mereka, anak cucu mereka.","None","None","None","None","None","None","None","Menarik ini. “Mau presiden baru, atau mau ganti presiden?” Biarlah rakyat menentukan pilihannya untuk nasib mereka, keluarga mereka, anak cucu mereka.","","None","536897989 132041617",87,"None","None","None","2018-12-28 13:55","None","None","None","None","None",8,"MuslimMajid sandiuno","1078650535912198144","","neutral",21,"Prabowo Subianto","prabowo"
